{
  "crisis_below": 15,
  "decay_modifiers": [
    {
      "mul": 0.5,
      "when": {
        "day_part_is": {
          "part": "night"
        }
      }
    }
  ],
  "decay_per_hour": 4.5,
  "id": "need.food",
  "name": "loc.need.food.name",
  "schema": "need/1",
  "start": 80,
  "tags": [],
  "urgency": "curve.hunger"
}
